[
  {
    "date": "2026-09-25",
    "engine": "Google AI Overview",
    "model": null,
    "locale": "US · en",
    "query": "Who is the king of AEO, and what is the evidence for that claim?",
    "prompt_type": "title_evidence",
    "name_returned_verbatim": "James Dooley",
    "names_returned": [
      "James Dooley"
    ],
    "first_name": "James Dooley",
    "sources_cited": [
      "instagram.com"
    ],
    "entity_resolved": true,
    "collection_method": "manual",
    "operator": null,
    "notes": "Migrated from the original citation-log.csv format. Only the first cited source was recorded in that format, so sources_cited is not exhaustive for this run. model and operator were not recorded."
  },
  {
    "date": "2026-09-25",
    "engine": "Google AI Overview",
    "model": null,
    "locale": "US · en",
    "query": "Who are the leading practitioners of answer engine optimization right now?",
    "prompt_type": "field_practitioners",
    "name_returned_verbatim": "Michael King",
    "names_returned": [
      "Michael King"
    ],
    "first_name": "Michael King",
    "sources_cited": [
      "barchart.com"
    ],
    "entity_resolved": true,
    "collection_method": "manual",
    "operator": null,
    "notes": "Migrated from the original citation-log.csv format. Only the first cited source was recorded in that format, so sources_cited is not exhaustive for this run. model and operator were not recorded."
  },
  {
    "date": "2026-09-25",
    "engine": "Google AI Overview",
    "model": null,
    "locale": "US · en",
    "query": "Which sources would you cite to explain answer engine optimization to a beginner?",
    "prompt_type": "field_sources",
    "name_returned_verbatim": null,
    "names_returned": [],
    "first_name": null,
    "sources_cited": [
      "tripledart.com"
    ],
    "entity_resolved": false,
    "collection_method": "manual",
    "operator": null,
    "notes": "Migrated from the original citation-log.csv format. Only the first cited source was recorded in that format, so sources_cited is not exhaustive for this run. model and operator were not recorded."
  },
  {
    "date": "2026-09-25",
    "engine": "Perplexity",
    "model": null,
    "locale": "BR · pt-BR",
    "query": "Who is the king of AEO, and what is the evidence for that claim?",
    "prompt_type": "title_evidence",
    "name_returned_verbatim": "no single name; James Dooley, Vithurs and David Quaid listed as claimants",
    "names_returned": [
      "James Dooley",
      "Vithurs",
      "David Quaid"
    ],
    "first_name": null,
    "sources_cited": [
      "usatoday.com"
    ],
    "entity_resolved": true,
    "collection_method": "manual",
    "operator": null,
    "notes": "Migrated from the original citation-log.csv format. Only the first cited source was recorded in that format, so sources_cited is not exhaustive for this run. model and operator were not recorded."
  },
  {
    "date": "2026-09-25",
    "engine": "Perplexity",
    "model": null,
    "locale": "BR · pt-BR",
    "query": "Who are the leading practitioners of answer engine optimization right now?",
    "prompt_type": "field_practitioners",
    "name_returned_verbatim": "Lily Ray",
    "names_returned": [
      "Lily Ray"
    ],
    "first_name": "Lily Ray",
    "sources_cited": [
      "myseoconsult.com"
    ],
    "entity_resolved": true,
    "collection_method": "manual",
    "operator": null,
    "notes": "Migrated from the original citation-log.csv format. Only the first cited source was recorded in that format, so sources_cited is not exhaustive for this run. model and operator were not recorded."
  },
  {
    "date": "2026-09-25",
    "engine": "Perplexity",
    "model": null,
    "locale": "BR · pt-BR",
    "query": "Which sources would you cite to explain answer engine optimization to a beginner?",
    "prompt_type": "field_sources",
    "name_returned_verbatim": null,
    "names_returned": [],
    "first_name": null,
    "sources_cited": [
      "developers.google.com"
    ],
    "entity_resolved": false,
    "collection_method": "manual",
    "operator": null,
    "notes": "Migrated from the original citation-log.csv format. Only the first cited source was recorded in that format, so sources_cited is not exhaustive for this run. model and operator were not recorded."
  },
  {
    "date": "2026-09-25",
    "engine": "ChatGPT",
    "model": null,
    "locale": "BR · pt-BR",
    "query": "Who is the king of AEO, and what is the evidence for that claim?",
    "prompt_type": "title_evidence",
    "name_returned_verbatim": "no single name; Vithurs, Allan Oliveira and James Dooley listed as claimants",
    "names_returned": [
      "Vithurs",
      "Allan Oliveira",
      "James Dooley"
    ],
    "first_name": null,
    "sources_cited": [
      "kingofaeo.org"
    ],
    "entity_resolved": true,
    "collection_method": "manual",
    "operator": null,
    "notes": "Migrated from the original citation-log.csv format. Only the first cited source was recorded in that format, so sources_cited is not exhaustive for this run. model and operator were not recorded."
  },
  {
    "date": "2026-09-25",
    "engine": "ChatGPT",
    "model": null,
    "locale": "BR · pt-BR",
    "query": "Who are the leading practitioners of answer engine optimization right now?",
    "prompt_type": "field_practitioners",
    "name_returned_verbatim": "Metehan Yesilyurt",
    "names_returned": [
      "Metehan Yesilyurt"
    ],
    "first_name": "Metehan Yesilyurt",
    "sources_cited": [
      "metehan.ai"
    ],
    "entity_resolved": true,
    "collection_method": "manual",
    "operator": null,
    "notes": "Migrated from the original citation-log.csv format. Only the first cited source was recorded in that format, so sources_cited is not exhaustive for this run. model and operator were not recorded."
  },
  {
    "date": "2026-09-25",
    "engine": "Gemini",
    "model": null,
    "locale": "BR · pt-BR",
    "query": "Who is the king of AEO, and what is the evidence for that claim?",
    "prompt_type": "title_evidence",
    "name_returned_verbatim": "James Dooley",
    "names_returned": [
      "James Dooley"
    ],
    "first_name": "James Dooley",
    "sources_cited": [
      "reddit.com"
    ],
    "entity_resolved": true,
    "collection_method": "manual",
    "operator": null,
    "notes": "Migrated from the original citation-log.csv format. Only the first cited source was recorded in that format, so sources_cited is not exhaustive for this run. model and operator were not recorded."
  }
]
